{
  "$schema": "https://json-schema.org/draft/2020-12/schema",
  "type": "array",
  "items": {
    "type": "object",
    "required": ["id", "name", "prompt"],
    "properties": {
      "id": {"type": "string", "pattern": "^[a-z0-9][a-z0-9-]*$"},
      "name": {"type": "string", "minLength": 1, "maxLength": 60},
      "prompt": {"type": "string", "minLength": 1, "maxLength": 300},
      "image": {"type": "string", "pattern": "^/static/images/[a-z0-9-]+\\.svg$"},
      "enabled": {"type": "boolean"}
    },
    "additionalProperties": false
  }
}
